{
  "$schema": "https://json-schema.org/draft/2020-12/schema",
  "title": "ChemLab Learning Task",
  "type": "object",
  "required": ["id", "goal", "activities"],
  "properties": {
    "id": {"type": "string"},
    "goal": {"type": "string"},
    "knowledge": {"type": "array", "items": {"type": "string"}},
    "activities": {"type": "array", "items": {"type": "object"}},
    "assessment": {"type": "object"},
    "nextTasks": {"type": "array", "items": {"type": "string"}}
  }
}
